{
  "schema_version": "1.0",
  "job_id": "job-incremental01",
  "trace_id": "trace-a07-002",
  "job_type": "INCREMENTAL_CHECK",
  "status": "SUCCEEDED",
  "input": {
    "base_commit": "1111111111111111111111111111111111111111",
    "repository": {
      "url": "https://example.com/course/sample-c-project.git",
      "commit": "2222222222222222222222222222222222222222"
    },
    "environment": {
      "image": "example/sample-c-project:gcc-debug",
      "project_root": "/workspace/project"
    },
    "build": {
      "clean_command": "make clean",
      "build_command": "make -j1",
      "verify_command": "make test",
      "timeout_seconds": 600
    },
    "configuration_id": "gcc-debug",
    "baseline": {
      "commit": "1111111111111111111111111111111111111111",
      "configuration_id": "gcc-debug",
      "actual_graph_uri": "artifact://pair07/full01/actual.json"
    },
    "commit": "2222222222222222222222222222222222222222",
    "defined_by": "A07",
    "idempotency_key": "a07-incremental-001"
  },
  "execution": {
    "created_at": "2026-09-20T10:05:00Z",
    "queued_at": "2026-09-20T10:05:00Z",
    "started_at": "2026-09-20T10:05:01Z",
    "finished_at": "2026-09-20T10:05:20Z",
    "attempts": 1
  },
  "output": {
    "artifacts": [
      {
        "artifact_id": "updated-graph-001",
        "type": "ACTUAL_GRAPH",
        "uri": "artifact://pair07/incremental01/actual.json",
        "media_type": "application/json",
        "producer_job_id": "job-incremental01"
      },
      {
        "artifact_id": "incremental-report-001",
        "type": "ERROR_REPORT",
        "uri": "artifact://pair07/incremental01/error_report.json",
        "media_type": "application/json",
        "producer_job_id": "job-incremental01"
      }
    ]
  },
  "error": null
}
